{
  "schemaVersion": "1.0.0",
  "projectId": "PRJ-REAL-APT-0001",
  "researchId": "PRICE-RESEARCH-PRJ-REAL-APT-0001-WINDOW-GLASS-HARDWARE-001",
  "researchName": "PRJ-REAL-APT-0001 창호/유리/하드웨어/실링 단가 조사",
  "status": "NEEDS_RESEARCH",
  "approvalPolicy": {
    "masterDbDirectUpdateAllowed": false,
    "approvalRequiredBeforeMasterDbUpdate": true,
    "approvalRequestType": "MasterDbUpdateRequest",
    "rollbackRequired": true,
    "approvedBy": "CEO"
  },
  "items": [
    {
      "projectId": "PRJ-REAL-APT-0001",
      "itemId": "WIN-SYSTEM-001",
      "itemName": "시스템창호",
      "category": "Window",
      "subcategory": "system_window",
      "brandName": "NEEDS_RESEARCH",
      "brandCandidates": ["LX하우시스", "KCC", "현대L&C", "이건창호", "필로브", "레하우"],
      "modelName": "NEEDS_RESEARCH",
      "standardSpec": "단열/기밀 성능 등급 조사",
      "replacementScope": "conditional",
      "thickness": "NEEDS_RESEARCH",
      "frameType": "NEEDS_RESEARCH",
      "glassSpec": "NEEDS_RESEARCH",
      "unit": "m2",
      "quantityBasis": "실측 면적, 개폐 방식, 철거/양중 기준",
      "officialPrice": "NEEDS_RESEARCH",
      "marketPrice": "NEEDS_RESEARCH",
      "dealerPrice": "NEEDS_RESEARCH",
      "supplierPrice": "NEEDS_RESEARCH",
      "internalPrice": "NEEDS_RESEARCH",
      "laborCost": "NEEDS_RESEARCH",
      "accessoryCost": "NEEDS_RESEARCH",
      "installationDifficulty": "UNKNOWN",
      "warrantyPeriod": "NEEDS_RESEARCH",
      "asPolicy": "NEEDS_RESEARCH",
      "commonDefectRisk": ["누수", "결로", "기밀 불량", "하드웨어 불량", "납기 지연"],
      "condensationRisk": "HIGH",
      "minimumOrderUnit": "NEEDS_RESEARCH",
      "leadTimeDays": "NEEDS_RESEARCH",
      "paymentCondition": "NEEDS_RESEARCH",
      "preferredSupplier": "NEEDS_RESEARCH",
      "alternativeItems": ["PVC 창호", "이중창", "로이유리 적용 일반창"],
      "sourceCandidates": [
        {"sourceType": "dealer", "sourceName": "시스템창호 브랜드 대리점", "dataToCollect": ["dealerPrice", "supplierPrice", "leadTimeDays", "warrantyPeriod", "asPolicy"]},
        {"sourceType": "installer", "sourceName": "창호 전문 시공팀", "dataToCollect": ["laborCost", "installationDifficulty", "defectHistory"]},
        {"sourceType": "internal", "sourceName": "ECOREAN 결로/하자 기록", "dataToCollect": ["condensationHistory", "claimCost", "actualLeadTimeDays"]}
      ],
      "sourceType": "NEEDS_RESEARCH",
      "sourceName": "NEEDS_RESEARCH",
      "sourceDate": "NEEDS_RESEARCH",
      "confidenceLevel": "UNKNOWN",
      "updateCycle": "monthly_until_verified",
      "approvalStatus": "NEEDS_RESEARCH",
      "approvalFlow": {"nextStep": "CREATE_MASTER_DB_UPDATE_REQUEST", "approvalRequestType": "MasterDbUpdateRequest", "masterDbUpdateAllowedBeforeApproval": false, "rollbackRequired": true},
      "notes": "부분 교체 시 기존 창호와 단열 성능 차이로 결로가 발생할 수 있다."
    },
    {
      "projectId": "PRJ-REAL-APT-0001",
      "itemId": "WIN-ALUMINUM-001",
      "itemName": "일반 알루미늄 창호",
      "category": "Window",
      "subcategory": "aluminum_window",
      "brandName": "NEEDS_RESEARCH",
      "brandCandidates": ["KCC", "LX하우시스", "현대L&C", "지역 알루미늄 창호 업체"],
      "modelName": "NEEDS_RESEARCH",
      "standardSpec": "일반 알루미늄 프레임 사양 조사",
      "replacementScope": "partial",
      "thickness": "NEEDS_RESEARCH",
      "frameType": "NEEDS_RESEARCH",
      "glassSpec": "NEEDS_RESEARCH",
      "unit": "m2",
      "quantityBasis": "실측 면적, 프레임 규격, 철거 포함 여부",
      "officialPrice": "NEEDS_RESEARCH",
      "marketPrice": "NEEDS_RESEARCH",
      "dealerPrice": "NEEDS_RESEARCH",
      "supplierPrice": "NEEDS_RESEARCH",
      "internalPrice": "NEEDS_RESEARCH",
      "laborCost": "NEEDS_RESEARCH",
      "accessoryCost": "NEEDS_RESEARCH",
      "installationDifficulty": "UNKNOWN",
      "warrantyPeriod": "NEEDS_RESEARCH",
      "asPolicy": "NEEDS_RESEARCH",
      "commonDefectRisk": ["결로", "기밀 불량", "틀 뒤틀림", "실리콘 하자"],
      "condensationRisk": "HIGH",
      "minimumOrderUnit": "NEEDS_RESEARCH",
      "leadTimeDays": "NEEDS_RESEARCH",
      "paymentCondition": "NEEDS_RESEARCH",
      "preferredSupplier": "NEEDS_RESEARCH",
      "alternativeItems": ["PVC 창호", "이중창", "시스템창호"],
      "sourceCandidates": [
        {"sourceType": "supplier", "sourceName": "지역 창호 제작 업체", "dataToCollect": ["supplierPrice", "fabricationLeadTime", "measurementPolicy"]},
        {"sourceType": "installer", "sourceName": "창호 시공팀", "dataToCollect": ["laborCost", "preferredFrameType", "defectRate"]}
      ],
      "sourceType": "NEEDS_RESEARCH",
      "sourceName": "NEEDS_RESEARCH",
      "sourceDate": "NEEDS_RESEARCH",
      "confidenceLevel": "UNKNOWN",
      "updateCycle": "monthly_until_verified",
      "approvalStatus": "NEEDS_RESEARCH",
      "approvalFlow": {"nextStep": "CREATE_MASTER_DB_UPDATE_REQUEST", "approvalRequestType": "MasterDbUpdateRequest", "masterDbUpdateAllowedBeforeApproval": false, "rollbackRequired": true},
      "notes": "저가 선택 시 결로 클레임 가능성을 고객 설명에 반영한다."
    },
    {
      "projectId": "PRJ-REAL-APT-0001",
      "itemId": "WIN-PVC-001",
      "itemName": "PVC 창호",
      "category": "Window",
      "subcategory": "pvc_window",
      "brandName": "NEEDS_RESEARCH",
      "brandCandidates": ["KCC", "LX하우시스", "현대L&C", "재현하늘창"],
      "modelName": "NEEDS_RESEARCH",
      "standardSpec": "PVC 프레임, 단열 등급 조사",
      "replacementScope": "partial",
      "thickness": "NEEDS_RESEARCH",
      "frameType": "NEEDS_RESEARCH",
      "glassSpec": "NEEDS_RESEARCH",
      "unit": "m2",
      "quantityBasis": "실측 면적, 프레임 폭, 유리 사양 기준",
      "officialPrice": "NEEDS_RESEARCH",
      "marketPrice": "NEEDS_RESEARCH",
      "dealerPrice": "NEEDS_RESEARCH",
      "supplierPrice": "NEEDS_RESEARCH",
      "internalPrice": "NEEDS_RESEARCH",
      "laborCost": "NEEDS_RESEARCH",
      "accessoryCost": "NEEDS_RESEARCH",
      "installationDifficulty": "UNKNOWN",
      "warrantyPeriod": "NEEDS_RESEARCH",
      "asPolicy": "NEEDS_RESEARCH",
      "commonDefectRisk": ["틀 처짐", "롤러 불량", "결로", "하부 레일 누수"],
      "condensationRisk": "MEDIUM",
      "minimumOrderUnit": "NEEDS_RESEARCH",
      "leadTimeDays": "NEEDS_RESEARCH",
      "paymentCondition": "NEEDS_RESEARCH",
      "preferredSupplier": "NEEDS_RESEARCH",
      "alternativeItems": ["시스템창호", "이중창", "알루미늄 창호"],
      "sourceCandidates": [
        {"sourceType": "dealer", "sourceName": "KCC/LX/현대L&C 대리점", "dataToCollect": ["dealerPrice", "supplierPrice", "frameGrade", "asPolicy"]},
        {"sourceType": "installer", "sourceName": "창호 시공팀", "dataToCollect": ["laborCost", "installationDifficulty", "preferredBrand"]}
      ],
      "sourceType": "NEEDS_RESEARCH",
      "sourceName": "NEEDS_RESEARCH",
      "sourceDate": "NEEDS_RESEARCH",
      "confidenceLevel": "UNKNOWN",
      "updateCycle": "monthly_until_verified",
      "approvalStatus": "NEEDS_RESEARCH",
      "approvalFlow": {"nextStep": "CREATE_MASTER_DB_UPDATE_REQUEST", "approvalRequestType": "MasterDbUpdateRequest", "masterDbUpdateAllowedBeforeApproval": false, "rollbackRequired": true},
      "notes": "구축 아파트 부분 교체 기본 후보."
    },
    {
      "projectId": "PRJ-REAL-APT-0001",
      "itemId": "WIN-SINGLE-001",
      "itemName": "단창",
      "category": "Window",
      "subcategory": "single_window",
      "brandName": "NEEDS_RESEARCH",
      "brandCandidates": ["KCC", "LX하우시스", "현대L&C", "지역 창호 업체"],
      "modelName": "NEEDS_RESEARCH",
      "standardSpec": "단창 구성 사양 조사",
      "replacementScope": "conditional",
      "thickness": "NEEDS_RESEARCH",
      "frameType": "NEEDS_RESEARCH",
      "glassSpec": "NEEDS_RESEARCH",
      "unit": "m2",
      "quantityBasis": "실측 면적 기준",
      "officialPrice": "NEEDS_RESEARCH",
      "marketPrice": "NEEDS_RESEARCH",
      "dealerPrice": "NEEDS_RESEARCH",
      "supplierPrice": "NEEDS_RESEARCH",
      "internalPrice": "NEEDS_RESEARCH",
      "laborCost": "NEEDS_RESEARCH",
      "accessoryCost": "NEEDS_RESEARCH",
      "installationDifficulty": "UNKNOWN",
      "warrantyPeriod": "NEEDS_RESEARCH",
      "asPolicy": "NEEDS_RESEARCH",
      "commonDefectRisk": ["결로", "단열 부족", "소음", "기밀 불량"],
      "condensationRisk": "HIGH",
      "minimumOrderUnit": "NEEDS_RESEARCH",
      "leadTimeDays": "NEEDS_RESEARCH",
      "paymentCondition": "NEEDS_RESEARCH",
      "preferredSupplier": "NEEDS_RESEARCH",
      "alternativeItems": ["이중창", "삼중창", "시스템창호"],
      "sourceCandidates": [
        {"sourceType": "supplier", "sourceName": "창호 제작 업체", "dataToCollect": ["supplierPrice", "leadTimeDays", "availableGlassSpec"]},
        {"sourceType": "internal", "sourceName": "결로 클레임 기록", "dataToCollect": ["condensationRate", "claimRisk"]}
      ],
      "sourceType": "NEEDS_RESEARCH",
      "sourceName": "NEEDS_RESEARCH",
      "sourceDate": "NEEDS_RESEARCH",
      "confidenceLevel": "UNKNOWN",
      "updateCycle": "monthly_until_verified",
      "approvalStatus": "NEEDS_RESEARCH",
      "approvalFlow": {"nextStep": "CREATE_MASTER_DB_UPDATE_REQUEST", "approvalRequestType": "MasterDbUpdateRequest", "masterDbUpdateAllowedBeforeApproval": false, "rollbackRequired": true},
      "notes": "결로 일부 있음 프로젝트에서는 자동 추천 금지."
    },
    {
      "projectId": "PRJ-REAL-APT-0001",
      "itemId": "WIN-DOUBLE-001",
      "itemName": "이중창",
      "category": "Window",
      "subcategory": "double_window",
      "brandName": "NEEDS_RESEARCH",
      "brandCandidates": ["KCC", "LX하우시스", "현대L&C", "재현하늘창"],
      "modelName": "NEEDS_RESEARCH",
      "standardSpec": "이중창 프레임/유리 구성 조사",
      "replacementScope": "partial",
      "thickness": "NEEDS_RESEARCH",
      "frameType": "NEEDS_RESEARCH",
      "glassSpec": "NEEDS_RESEARCH",
      "unit": "m2",
      "quantityBasis": "실측 면적, 외창/내창 구성 기준",
      "officialPrice": "NEEDS_RESEARCH",
      "marketPrice": "NEEDS_RESEARCH",
      "dealerPrice": "NEEDS_RESEARCH",
      "supplierPrice": "NEEDS_RESEARCH",
      "internalPrice": "NEEDS_RESEARCH",
      "laborCost": "NEEDS_RESEARCH",
      "accessoryCost": "NEEDS_RESEARCH",
      "installationDifficulty": "UNKNOWN",
      "warrantyPeriod": "NEEDS_RESEARCH",
      "asPolicy": "NEEDS_RESEARCH",